id;de;fr;en;it
A16.5;Die meisten Sträucher der Hecke sind heimisch. Jedoch könnten es noch mehr unterschiedliche heimsiche Straucharten sein. Denn je mehr verschiedene Straucharten, desto mehr verschiedene Vögel und kleine Säugetiere können sich davon ernähren. <br><strong>Verbesserungs-Tipp:</strong><br> Ergänze die bestehende Hecke mit zusätzlichen heimischen Straucharten. Pflanze auch neue Hecken. Die Hecken sollten aus möglichst vielen verschiedenen heimischen Straucharten bestehen. Wenn möglich sollten die neuen Hecken mindestens 4 Meter lang sein.<br>;La plupart des arbustes de la haie sont indigènes. Cependant, il pourrait y avoir encore plus d'espèces d'arbustes indigènes différentes. En effet, plus il y a d'espèces d'arbustes différentes, plus il y a d'oiseaux et de petits mammifères différents qui peuvent s'en nourrir. <br><strong>Conseil d'amélioration:</strong><br> Complète la haie existante avec des espèces d'arbustes indigènes supplémentaires. Plante également de nouvelles haies. Les haies devraient être composées du plus grand nombre possible d'espèces d'arbustes indigènes différentes. Si possible, les nouvelles haies devraient mesurer au moins 4 mètres de long.<br>;Most of the shrubs in the hedge are native. However, there could be more different native shrub species. This is because the more different shrub species, the more different birds and small mammals can feed on them. <br><strong>Improvement Tip:</strong><br> Add additional native shrub species to the existing hedge. Plant new hedges as well. The hedges should consist of as many different native shrub species as possible. If possible, the new hedges should be at least 4 feet long.<br>;La maggior parte degli arbusti della siepe sono autoctoni. Tuttavia, potrebbero esserci più specie di arbusti autoctoni. Questo perché più specie di arbusti sono diverse, più uccelli e piccoli mammiferi possono cibarsene. <br><strong>Suggerimento per il miglioramento:</strong><br> Aggiungere altre specie arbustive autoctone alla siepe esistente. Piantate anche nuove siepi. Le siepi dovrebbero essere composte da un numero il più possibile elevato di specie arbustive autoctone. Se possibile, le nuove siepi dovrebbero essere lunghe almeno 4 metri
A16.6;Eine deiner Hecken ist besonders lang und breit. Optimal! <br><strong>Verbesserungs-Tipp:</strong><br> Vielleicht findest du noch Platz für weitere Hecken. Die Hecken sollten aus möglichst vielen verschiedenen heimischen Straucharten bestehen. Wenn möglich sollten die Hecken mindestens 4 Meter lang sein.<br> <br><strong>Pflege-Tipp:</strong><br>  Alle paar Jahre müssen Hecken geschnitten werden. Schneide aber nie die ganze Hecke, sondern immer nur Teile davon. Die nicht geschnittenen Teile bieten so immer noch Nahrung und Versteck für Tiere. Der beste Zeitpunkt für den Heckenschnitt ist zwischen November bis März. Bei der Pflege und der Verbesserung kann dich eine Fachperson von der<br>BioDiv-Kontaktliste<br>beraten.;Une de tes haies est particulièrement longue et large. C'est optimal ! <br><strong>Conseil d'amélioration:</strong><br> Tu trouveras peut-être encore de la place pour d'autres haies. Les haies devraient être composées d'un maximum d'espèces d'arbustes indigènes différentes. Si possible, les haies devraient mesurer au moins 4 mètres de long.<br> <br><strong>Conseil d'entretien:</strong><br> Les haies doivent être taillées tous les deux ans. Cependant, ne taille jamais toute la haie, mais seulement certaines parties. Les parties non taillées offrent ainsi toujours de la nourriture et des cachettes pour les animaux. Le meilleur moment pour tailler les haies se situe entre novembre et mars. Pour l'entretien et l'amélioration, un spécialiste de la<br>liste de contacts BioDiv<br> peut te conseiller;One of your hedges is particularly long and wide. Optimal! <br><strong>Improvement Tip:</strong><br> You may find room for more hedges. The hedges should consist of as many different native shrub species as possible. If possible, the hedges should be at least 4 meters long.<br> <br><strong>Maintenance Tip:</strong><br> Every few years, hedges need to be cut. However, never cut the whole hedge, but always only parts of it. Thus, the uncut parts still provide food and hiding places for animals. The best time for hedge trimming is between November to March. For maintenance and improvement, a professional from the<br>BioDiv contact list<br>can advise you;Una delle vostre siepi è particolarmente lunga e larga. Ottimale! <br><strong>Consiglio di miglioramento:</strong><br> Potreste trovare spazio per altre siepi. Le siepi dovrebbero essere composte da un numero il più possibile elevato di specie arbustive autoctone. Se possibile, le siepi dovrebbero essere lunghe almeno 4 metri.<br> <br><strong>Suggerimento per la manutenzione:</strong><br> Ogni pochi anni, le siepi devono essere potate. Tuttavia, non tagliate mai l'intera siepe, ma solo parti di essa. In questo modo, le parti non tagliate continuano a fornire cibo e nascondigli agli animali. Il periodo migliore per tagliare una siepe è tra novembre e marzo. Un professionista dell'elenco dei contatti di BioDiv<br>può consigliarvi sulla manutenzione e sul miglioramento
A16.7;Leider ist keine der Hecken besonders lang und breit. <br><strong>Verbesserungs-Tipp:</strong><br> Vergrössere die bestehenden Hecken in die Länge sowie in die Breite. Pflanze auch neue Hecken. Die Hecken sollten aus möglichst vielen verschiedenen heimischen Straucharten bestehen. Wenn möglich sollten die neuen Hecken mindestens 4 Meter lang sein. <br><strong>Pflege-Tipp:</strong><br>  Alle paar Jahre müssen Hecken geschnitten werden. Schneide aber nie die ganze Hecke, sondern immer nur Teile davon. Die nicht geschnittenen Teile bieten so immer noch Nahrung und Versteck für Tiere. Der beste Zeitpunkt für den Heckenschnitt ist zwischen November bis März. Bei der Pflege und der Verbesserung kann dich eine Fachperson von der<br>BioDiv-Kontaktliste<br>beraten.;Malheureusement, aucune des haies n'est particulièrement longue et large. <br><strong>Conseil d'amélioration:</strong><br> Agrandis les haies existantes en longueur et en largeur. Plante également de nouvelles haies. Les haies devraient être composées du plus grand nombre possible d'espèces d'arbustes indigènes différentes. Si possible, les nouvelles haies devraient mesurer au moins 4 mètres de long. <br><strong>Conseil d'entretien:</strong><br> Les haies doivent être taillées tous les deux ans. Cependant, ne taille jamais toute la haie, mais seulement certaines parties. Les parties non taillées offrent ainsi toujours de la nourriture et des cachettes pour les animaux. Le meilleur moment pour tailler les haies se situe entre novembre et mars. Pour l'entretien et l'amélioration, un spécialiste de la<br>liste de contacts BioDiv<br> peut te conseiller;Unfortunately, none of the hedges are particularly long or wide. <br><strong>Improvement Tip:</strong><br>Increase the length as well as the width of the existing hedges. Plant new hedges as well. The hedges should consist of as many different native shrub species as possible. If possible, the new hedges should be at least 4 meters long. <br><strong>Maintenance Tip:</strong><br> Every few years, hedges need to be trimmed. However, never cut the whole hedge, but always only parts of it. The uncut parts thus still provide food and hiding places for animals. The best time for hedge trimming is between November to March. For maintenance and improvement, a professional from the<br>BioDiv contact list<br>can advise you;Purtroppo nessuna delle siepi è particolarmente lunga o larga. <br><strong>Consiglio di miglioramento:</strong><br>Aumentate la lunghezza e la larghezza delle siepi esistenti. Piantate anche nuove siepi. Le siepi dovrebbero essere composte da un numero il più possibile elevato di specie arbustive autoctone. Se possibile, le nuove siepi dovrebbero essere lunghe almeno 4 metri. <br><strong>Suggerimento per la manutenzione:</strong><br> Le siepi devono essere tagliate ogni pochi anni. Tuttavia, non tagliate mai l'intera siepe, ma solo parti di essa. In questo modo, le parti non tagliate continuano a fornire cibo e nascondigli agli animali. Il periodo migliore per tagliare una siepe è tra novembre e marzo. Un professionista dell'elenco dei contatti di BioDiv<br>può consigliarvi sulla manutenzione e sul miglioramento
A17.0;Du hast nicht eingetragen, ob Bäume, Sträucher und heimische Blumen oder Gräser zusammen an einem Ort anzutreffen sind. Kommen diese unterschiedlichen Elemente an der gleichen Stelle vor, so finden auch mehr Lebewesen einen Lebensraum mit Nahrung und Versteck.;Tu n'as pas indiqué si les arbres, les arbustes et les fleurs ou les graminées indigènes se rencontrent ensemble au même endroit. Si ces différents éléments sont présents au même endroit, davantage d'êtres vivants y trouveront un habitat avec de la nourriture et un endroit où se cacher;You did not record whether trees, shrubs, and native flowers or grasses are found together in one place. If these different elements occur in the same place, more creatures will also find a habitat with food and hiding places;Non avete registrato se alberi, arbusti e fiori o erbe autoctone si trovano insieme in un unico luogo. Se questi diversi elementi si trovano nello stesso luogo, un maggior numero di creature troverà un habitat con cibo e nascondigli
A17.1;Bäume, Sträucher und heimische Blumen oder Gräser sind nirgends zusammen anzutreffen. Kommen diese unterschiedlichen Elemente an der gleichen Stelle vor, so finden auch mehr Lebewesen einen Lebensraum mit Nahrung und Versteck. <br><strong>Verbesserungs-Tipp:</strong><br> Pflanze unter Bäumen verschiedene heimische Sträucher. Sorge dafür, dass die Wiese ungefähr 1 Meter rund um Sträucher und Bäume stehenbleiben. Diese Wiesen sollen nur alle 2 Jahre gemäht werden. Am besten werden jeweils nur Abschnitte dieser Wiesen gemäht. So können sich Kleintiere in die nicht gemähten Abschnitten zurückziehen.;Les arbres, les arbustes et les fleurs ou les herbes indigènes ne se rencontrent nulle part ensemble. Si ces différents éléments sont présents au même endroit, davantage d'êtres vivants trouveront un habitat avec de la nourriture et un endroit où se cacher. <br><strong>Conseil d'amélioration:</strong><br> Plantez différents arbustes indigènes sous les arbres. Veille à ce que la prairie reste à environ 1 mètre autour des arbustes et des arbres. Ces prairies ne doivent être fauchées que tous les deux ans. Il est préférable de ne faucher que certaines parties de ces prairies. Ainsi, les petits animaux peuvent se retirer dans les parties non fauchées;Trees, shrubs, and native flowers or grasses are not found together anywhere. If these different elements occur in the same place, more living things will also find a habitat with food and hiding places. <br><strong>Improvement Tip:</strong><br> Plant a variety of native shrubs under trees. Make sure the meadow is left about 1 meter around shrubs and trees. These meadows should only be mowed every 2 years. It is best to mow only sections of these meadows at a time. This allows small animals to retreat to the sections that are not mowed;Alberi, arbusti e fiori o erbe autoctone non si trovano insieme da nessuna parte. Se questi diversi elementi si trovano nello stesso luogo, anche altri esseri viventi troveranno un habitat con cibo e nascondigli. <br><strong>Consiglio per il miglioramento: </strong><br>Piantare diversi arbusti autoctoni sotto gli alberi. Assicurarsi che il prato sia lasciato a circa 1 metro intorno ad arbusti e alberi. Questi prati dovrebbero essere falciati solo ogni 2 anni. È meglio tagliare solo alcune parti di questi prati alla volta. Questo permette ai piccoli animali di ritirarsi nelle sezioni non falciate
A17.2;Bäume, Sträucher und heimische Blumen oder Gräser kommen teilweise zusammen vor. Kommen alle unterschiedlichen Elemente an der gleichen Stelle vor, so finden auch mehr Lebewesen einen Lebensraum mit Nahrung und Versteck. <br><strong>Verbesserungs-Tipp:</strong><br> Pflanze unter Bäumen verschiedene heimische Sträucher. Sorge dafür, dass die Wiese ungefähr 1 Meter rund um Sträucher und Bäume stehenbleiben. Diese Wiesen sollen nur alle 2 Jahre gemäht werden. Am besten werden jeweils nur Abschnitte dieser Wiesen gemäht. So können sich Kleintiere in die nicht gemähten Abschnitten zurückziehen.;Les arbres, les arbustes et les fleurs ou graminées indigènes sont parfois présents ensemble. Si tous les différents éléments sont présents au même endroit, davantage d'êtres vivants trouveront un habitat avec de la nourriture et une cachette. <br><strong>Conseil d'amélioration:</strong><br> Plantez différents arbustes indigènes sous les arbres. Veille à ce que la prairie reste à environ 1 mètre autour des arbustes et des arbres. Ces prairies ne doivent être fauchées que tous les deux ans. Il est préférable de ne faucher que certaines parties de ces prairies. Ainsi, les petits animaux peuvent se retirer dans les parties non fauchées;Trees, shrubs, and native flowers or grasses sometimes occur together. If all the different elements occur in the same place, more creatures will also find a habitat with food and hiding places. <br><strong>Improvement Tip:</strong><br> Plant a variety of native shrubs under trees. Make sure the meadow is left about 1 meter around shrubs and trees. These meadows should only be mowed every 2 years. It is best to mow only sections of these meadows at a time. This allows small animals to retreat to the sections that are not mowed;Alberi, arbusti e fiori o erbe autoctone sono talvolta presenti insieme. Se tutti i diversi elementi si trovano nello stesso luogo, un maggior numero di creature troverà un habitat con cibo e nascondigli. <br><strong>Consiglio per il miglioramento: </strong><br>Piantare diversi arbusti autoctoni sotto gli alberi. Assicurarsi che il prato sia lasciato a circa 1 metro intorno ad arbusti e alberi. Questi prati dovrebbero essere falciati solo ogni 2 anni. È meglio falciare solo alcune parti di questi prati alla volta. Questo permette ai piccoli animali di ritirarsi nelle sezioni non falciate
A17.3;Bäume, Sträucher und heimische Blumen oder Gräser kommen an einer Stelle zusammen vor. Kommen alle unterschiedlichen Elemente an der gleichen Stelle vor, so finden auch mehr Lebewesen einen Lebensraum mit Nahrung und Versteck. <br><strong>Verbesserungs-Tipp:</strong><br> Schau, ob sich die drei Elemente Bäume, Sträucher und heimische Blumen oder Gräser an weiteren Stellen kombinieren lassen. <br><strong>Pflege-Tipp:</strong><br>  Sorge dafür, dass die Wiese ungefähr 1 Meter rund um Sträucher und Bäume stehenbleiben. Diese Wiesen sollen nur alle 2 Jahre gemäht werden. Am besten werden jeweils nur Abschnitte dieser Wiesen gemäht. So können sich Kleintiere in die nicht gemähten Abschnitten zurückziehen.;Les arbres, les arbustes et les fleurs ou graminées indigènes sont présents ensemble au même endroit. Si tous les différents éléments sont présents au même endroit, davantage d'êtres vivants trouveront un habitat avec de la nourriture et une cachette. <br><strong>Conseil d'amélioration:</strong><br> Regarde si les trois éléments que sont les arbres, les arbustes et les fleurs ou les herbes indigènes peuvent être combinés à d'autres endroits. <br><strong>Conseil d'entretien:</strong><br> Veille à ce que la prairie reste à environ 1 mètre autour des arbustes et des arbres. Ces prairies ne doivent être fauchées que tous les deux ans. Il est préférable de ne faucher que certaines parties de ces prairies. Ainsi, les petits animaux peuvent se retirer dans les parties non fauchées;Trees, shrubs, and native flowers or grasses occur together in one place. If all the different elements occur in the same place, more creatures will also find a habitat with food and hiding places. <br><strong>Improvement Tip:</strong><br> See if the three elements of trees, shrubs and native flowers or grasses can be combined in more places. <br><strong>Maintenance Tip:</strong><br> Make sure the meadow is left about 1 meter around shrubs and trees. These meadows should only be mowed every 2 years. It is best to mow only sections of these meadows at a time. This allows small animals to retreat to the sections that are not mowed;Alberi, arbusti e fiori o erbe autoctone si trovano insieme in un unico luogo. Se tutti i diversi elementi si trovano nello stesso luogo, un maggior numero di creature troverà un habitat con cibo e nascondigli. <br><strong>Suggerimento per il miglioramento: </strong><br>Vedete se i tre elementi alberi, arbusti e fiori o erbe autoctone possono essere combinati in altri luoghi. <br><strong>Consiglio per la manutenzione:</strong><br> Assicuratevi che il prato sia lasciato a circa 1 metro di distanza da arbusti e alberi. Questi prati dovrebbero essere falciati solo ogni 2 anni. È meglio falciare solo alcune parti di questi prati alla volta. Questo permette ai piccoli animali di ritirarsi nelle sezioni non falciate
A17.4;Bäume, Sträucher und heimische Blumen oder Gräser kommen an mehreren Stelle zusammen vor. Kommen alle unterschiedlichen Elemente an der gleichen Stelle vor, so finden auch mehr Lebewesen einen Lebensraum mit Nahrung und Versteck. <br><strong>Pflege-Tipp:</strong><br>  Sorge dafür, dass die Wiese ungefähr 1 Meter rund um Sträucher und Bäume stehenbleiben. Diese Wiesen sollen nur alle 2 Jahre gemäht werden. Am besten werden jeweils nur Abschnitte dieser Wiesen gemäht. So können sich Kleintiere in die nicht gemähten Abschnitten zurückziehen.;Les arbres, les arbustes et les fleurs ou graminées indigènes sont présents à plusieurs endroits. Si tous les différents éléments sont présents au même endroit, davantage d'êtres vivants trouveront un habitat avec de la nourriture et une cachette. <br><strong>Conseil d'entretien:</strong><br> Veille à ce que la prairie reste à environ 1 mètre autour des arbustes et des arbres. Ces prairies ne doivent être fauchées que tous les deux ans. Il est préférable de ne faucher que certaines parties de ces prairies. Ainsi, les petits animaux peuvent se retirer dans les parties non fauchées;Trees, shrubs, and native flowers or grasses occur together in several places. If all the different elements occur in the same place, more creatures will also find a habitat with food and hiding places. <br><strong>Maintenance Tip:</strong><br> Make sure the meadow is left about 1 meter around shrubs and trees. These meadows should only be mowed every 2 years. It is best to mow only sections of these meadows at a time. This allows small animals to retreat to the sections that are not mowed;Alberi, arbusti e fiori o erbe autoctone sono presenti insieme in diversi punti. Se tutti i diversi elementi si trovano nello stesso luogo, un maggior numero di creature troverà un habitat con cibo e nascondigli. <br><strong>Consiglio per la manutenzione:</strong><br> Assicuratevi che il prato sia lasciato a circa 1 metro di distanza da arbusti e alberi. Questi prati dovrebbero essere falciati solo ogni 2 anni. È meglio falciare solo alcune parti di questi prati alla volta. In questo modo, i piccoli animali possono ritirarsi nelle sezioni non falciate
A18.0;Du hast nicht eingetragen, ob es auf der Untersuchungsfläche<br>Ruderalflächen<br>mit passenden heimischen Pflanzen gibt. Auf Ruderalflächen finden sich oft seltene Pflanzen- und Tierarten.;Tu n'as pas indiqué s'il existe sur la surface étudiée des<br>surfaces rudérales<br> avec des plantes indigènes adaptées. Sur les surfaces rudérales, on trouve souvent des espèces végétales et animales rares;You have not entered whether there are any ruderal areas<br>with suitable native plants on the study site. Rare plant and animal species are often found in ruderal areas;Non è stato indicato se nel sito di studio siano presenti aree ruderali<br>con piante autoctone idonee. Nelle aree ruderali si trovano spesso specie animali e vegetali rare
A18.1;Es gibt auf der Untersuchungsfläche keine<br>Ruderalflächen. Auf Ruderalflächen finden sich oft seltene Pflanzen- und Tierarten. <br><strong>Verbesserungs-Tipp:</strong><br> Schaffe Ruderalflächen. Entferne dazu die obersten 10 cm des Bodens. Verteile dann Wandkies und Geröll ohne Humus. Und dann gilt es Geduld zu haben. Denn es dauert mindestens 2 Jahre, bis eine vielfältige Ruderalfläche entsteht. Beim Anlegen einer Ruderalfläche kann dich eine Fachperson von der<br>BioDiv-Kontaktliste<br>beraten. <br><strong>Pflege-Tipp:</strong><br>  Oft wachsen auch unerwünschte<br>invasive Neophyten. Solche Neophyten müssen durch Handarbeit entfernt werden.;Il n'y a pas de<br>surfaces rudérales sur la surface étudiée. Les surfaces rudérales abritent souvent des espèces végétales et animales rares. <br><strong>Conseil d'amélioration:</strong><br> Crée des surfaces rudérales. Enlève pour cela les 10 premiers centimètres du sol. Répartis ensuite du gravier mural et des cailloux sans humus. Ensuite, il faut faire preuve de patience. Il faut en effet au moins deux ans pour obtenir une surface rudérale diversifiée. Pour l'aménagement d'une surface rudérale, un spécialiste de la<br>liste de contacts BioDiv<br> peut te conseiller. <br><strong>Conseil d'entretien:</strong><br> Souvent, des<br>néophytes envahissantes indésirables poussent aussi. De telles néophytes doivent être éliminées par un travail manuel;There are no<br>ruderal areas on the study site. Rare plant and animal species are often found on ruderal areas. <br><strong>Improvement Tip:</strong><br>Create ruderal areas. Remove the top 10 cm of the soil for this purpose. Then spread wall gravel and rubble without humus. And then it is necessary to have patience. Because it takes at least 2 years to create a diverse ruderal area. When creating a ruderal area, a professional from the<br>BioDiv contact list<br>can advise you. <br><strong>Maintenance tip:</strong><br> Often unwanted<br>invasive neophytes also grow. Such neophytes must be removed by manual labor;Nel sito di studio non sono presenti<br>aree rurali. Nelle aree ruderali si trovano spesso specie animali e vegetali rare. <br><strong>Suggerimento per il miglioramento: </strong><br>Creare aree ruderali. Rimuovere gli ultimi 10 cm di terreno. Quindi spargere ghiaia e pietrisco senza humus. E poi è importante avere pazienza. Sono necessari almeno 2 anni per creare un'area ruderale diversificata. Per la creazione di un'area ruderale, si può richiedere la consulenza di uno specialista dell'elenco dei contatti<br>BioDiv. <br><strong>Consiglio per la manutenzione:</strong><br>Spesso crescono anche neofite indesiderate<br>invasive. Tali neofiti devono essere rimossi con il lavoro manuale<br>
A18.2;"Es gibt auf der Untersuchungsfläche<br>Ruderalflächen. Darauf wachsen allerdings<br>Neophyten. Neophyten verdrängen seltene Pflanzen- und Tierarten, die sonst auf Ruderalflächen wachsen. <br><strong>Pflege-Tipp:</strong><br>  Entferne alle Neophyten mitsamt den Wurzeln. Befolge dabei die Anweisungen von<br><a href=""http://www.neophyten-schweiz.ch"" target=""_blank"">http://www.neophyten-schweiz.ch</a>.";"Il existe sur la surface étudiée des<br>surfaces rudérales. Des néophytes y poussent toutefois<br>. Les néophytes évincent les espèces végétales et animales rares qui poussent normalement sur les surfaces rudérales. <br><strong>Conseil d'entretien:</strong><br> Enlève toutes les néophytes avec leurs racines. Pour cela, suis les instructions de<br><a href=""http://www.neophyten-schweiz.ch"" target=""_blank"">http://www.neophyten-schweiz.ch</a>";"There are ruderal areas on the study site<br>. However<br>neophytes grow on them. Neophytes displace rare plant and animal species that otherwise grow in ruderal areas. <br><strong>Care Tip:</strong><br>Remove all neophytes along with their roots. Follow instructions from<br><a href=""http://www.neophyten-schweiz.ch"" target=""_blank"">http://www.neophyten-schweiz.ch</a>.";"Nel sito di studio sono presenti aree ruderali<br>. Tuttavia<br>le neofite crescono su di esse. Le neofite spostano specie animali e vegetali rare che altrimenti crescono in aree ruderali. <br><strong>Consiglio per la cura:</strong><br>Eliminate tutte le neofite insieme alle loro radici. Seguire le istruzioni di<br><a href=""http://www.neophyten-schweiz.ch"" target=""_blank"">http://www.neophyten-schweiz.ch</a>."
