id;de;fr;en;it
A31.3;Auf mehr als der Hälfte der Fläche werden ökologische Mittel zur Schädlingsbekämpfung eingesetzt. Das ist eher viel! Denn auch ökologische Mittel töten manchmal nicht nur so genannte Schädlinge, sondern auch harmlose oder sogar nützliche Lebewesen. Am besten ist es deshalb, Schädlinge so wenig wie möglich zu bekämpfen. <br><strong>Verbesserungs-Tipp:</strong><br> Was passiert, wenn Schädlingen gar nicht bekämpft werden? Informiere dich darüber. Auf der<br>BioDiv-Praxisseite<br>findest du dazu weiterführende Informationen. Triff dich dann mit den Personen, die Schädlinge bekämpfen. Überlegt zusammen wie weniger Mittel zur Schädlingsbekämpfung eingesetzt werden können.;Des produits écologiques sont utilisés pour lutter contre les parasites sur plus de la moitié de la surface. C'est plutôt beaucoup ! En effet, même les produits écologiques tuent parfois non seulement les soi-disant nuisibles, mais aussi des êtres vivants inoffensifs ou même utiles. Le mieux est donc de lutter le moins possible contre les nuisibles. <br><strong>Conseil d'amélioration:</strong><br> Que se passe-t-il lorsque les nuisibles ne sont pas du tout combattus ? Informe-toi à ce sujet. Tu trouveras des informations complémentaires à ce sujet sur le site pratique de<br>BioDiv. Rencontre ensuite les personnes qui luttent contre les nuisibles. Réfléchis ensemble à la manière dont on peut utiliser moins de moyens pour lutter contre les nuisibles;On more than half of the area ecological means are used for pest control. That is rather a lot! Because even ecological means sometimes kill not only so-called pests, but also harmless or even useful creatures. Therefore, it is best to control pests as little as possible. <br><strong>Improvement Tip:</strong><br> What happens if pests are not controlled at all? Find out. On the<br>BioDiv practice page<br>you will find more information on this. Then meet with the people who control pests. Together, consider how fewer pest control resources can be used;Più della metà della terra è utilizzata per il controllo biologico dei parassiti. Sono davvero tanti! Perché anche i mezzi ecologici a volte uccidono non solo i cosiddetti parassiti, ma anche creature innocue o addirittura utili. È quindi meglio controllare i parassiti il meno possibile. <br><strong>Suggerimento per il miglioramento:</strong><br> Cosa succede se i parassiti non vengono controllati affatto? Scopritelo. Nella pagina di pratica<br>BioDiv<br>si possono trovare maggiori informazioni al riguardo. Poi incontrate le persone che controllano i parassiti. Pensate insieme a come utilizzare meno risorse per il controllo dei parassiti
A32.0;Es ist nicht angegeben, wie Unkraut bekämpft wird. Oft ist es gar nicht nötig, alles «sauber» zu halten. Denn so genannte Unkräuter tragen eigentlich auch zur Artenvielfalt bei.;"Il n'est pas indiqué comment lutter contre les mauvaises herbes. Souvent, il n'est même pas nécessaire de tout garder ""propre"". Car les soi-disant mauvaises herbes contribuent en fait aussi à la biodiversité";"It is not specified how weeds are controlled. Often it is not even necessary to keep everything ""clean"". Because so-called weeds actually also contribute to biodiversity";"Non è specificato come controllare le erbe infestanti. Spesso non è necessario tenere tutto ""pulito"". Perché anche le cosiddette erbacce contribuiscono alla biodiversità"
A32.1;Unkräuter werden zur Hauptsache mit chemischen Mitteln bekämpft. Das ist oft unnötig. Denn chemische Mittel schaden oft auch erwünschten Pflanzen. Chemische Mittel bleiben manchmal auch lange im Boden und gelangen mit dem Regenwasser in Gewässer. <br><strong>Verbesserungs-Tipp:</strong><br> Informiere dich über andere Möglichkeiten zur Bekämpfung von Unkräutern. Auf der<br>BioDiv-Praxisseite<br>findest du dazu weiterführende Informationen. Triff dich dann mit den Personen, die Unkräuter bekämpfen. Überlegt zusammen, wie weniger chemische Mittel eingesetzt werden können. <br><strong>Pflege-Tipp:</strong><br>  Unkraut durch Handarbeit zu bekämpfen ist sehr aufwendig. Erkundige dich, ob es möglich ist, dabei mitzuhelfen. Denn wenn du beim Jäten mithilfst, kann vielleicht auf schädliche Mittel verzichtet werden.;Les mauvaises herbes sont principalement combattues à l'aide de produits chimiques. C'est souvent inutile. En effet, les produits chimiques nuisent souvent aussi aux plantes souhaitées. Les produits chimiques restent aussi parfois longtemps dans le sol et se retrouvent dans les eaux avec l'eau de pluie. <br><strong>Conseil d'amélioration:</strong><br> Informe-toi sur les autres possibilités de lutte contre les mauvaises herbes. Tu trouveras des informations complémentaires à ce sujet sur le<br>site pratique de BioDiv<br>. Rencontre ensuite les personnes qui luttent contre les mauvaises herbes. Réfléchissez ensemble à la manière dont on peut utiliser moins de produits chimiques. <br><strong>Conseil d'entretien:</strong><br>Lutter contre les mauvaises herbes à la main demande beaucoup de travail. Renseigne-toi pour savoir s'il est possible de donner un coup de main. En effet, si tu participes au désherbage, il sera peut-être possible de renoncer à des produits nocifs;Weeds are mainly controlled by chemical means. This is often unnecessary. This is because chemical agents often harm desirable plants as well. Chemical agents sometimes also remain in the soil for a long time and get into water bodies with the rainwater. <br><strong>Improvement Tip:</strong><br> Find out about other ways to control weeds. Check the<br>BioDiv practice page<br>for more information. Then meet with people who control weeds. Think together about how to use fewer chemicals. <br><strong>Care Tip:</strong><br> To fight weeds by hand is very laborious. Find out if it is possible to help out. Because if you help with weeding, perhaps harmful means can be dispensed with;Le erbe infestanti sono controllate principalmente con prodotti chimici. Spesso non è necessario. Perché gli agenti chimici spesso danneggiano anche le piante desiderate. A volte gli agenti chimici rimangono nel terreno anche per molto tempo e finiscono nei corpi idrici con l'acqua piovana. <br><strong>Suggerimento per il miglioramento:</strong><br> Scoprite altri modi per controllare le erbacce. Per ulteriori informazioni, consultare la pagina pratica di BioDiv<br>. Poi incontrate le persone che controllano le erbacce. Pensate insieme a come utilizzare meno prodotti chimici. <br><strong>Consiglio per la cura:</strong><br> Combattere le erbacce a mano richiede molto tempo. Scoprite se è possibile dare una mano. Perché se si aiuta a diserbare, si può fare a meno di agenti nocivi
A32.2;Unkräuter werden zu einem grossen Teil mit chemischen Mitteln oder durch Abflammen und mit Hitze erzeugenden Geräten bekämpft. Chemische Mittel schaden oft auch erwünschten Pflanzen und bleiben oft lange im Boden Aber Abflammen und Hitze erzeugende Geräte schaden manchmal auch Lebewesen in den oberen Bodenschichten. <br><strong>Verbesserungs-Tipp:</strong><br> Informiere dich über andere Möglichkeiten zur Bekämpfung von Unkräutern. Auf der<br>BioDiv-Praxisseite<br>findest du dazu weiterführende Informationen. Triff dich dann mit den Personen, die Unkräuter bekämpfen. Überlegt zusammen, wie Unkräuter schonender bekämpft werden können. <br><strong>Pflege-Tipp:</strong><br>  Unkraut durch Handarbeit zu bekämpfen ist sehr aufwendig. Erkundige dich, ob es möglich ist, dabei mitzuhelfen. Denn wenn du beim Jäten mithilfst, kann vielleicht auf schädliche Mittel verzichtet werden.;Les mauvaises herbes sont en grande partie combattues à l'aide de produits chimiques ou en les brûlant à la flamme ou à l'aide d'appareils produisant de la chaleur. Les produits chimiques nuisent souvent aux plantes souhaitées et restent longtemps dans le sol, mais le brûlage et les appareils produisant de la chaleur nuisent parfois aussi aux organismes vivants dans les couches supérieures du sol. <br><strong>Conseil d'amélioration:</strong><br> Informe-toi sur d'autres possibilités de lutte contre les mauvaises herbes. Tu trouveras des informations complémentaires à ce sujet sur le<br>site pratique de BioDiv<br>. Rencontre ensuite les personnes qui luttent contre les mauvaises herbes. Réfléchissez ensemble à la manière de lutter plus efficacement contre les mauvaises herbes. <br><strong>Conseil d'entretien:</strong><br>La lutte contre les mauvaises herbes à la main est très coûteuse. Renseigne-toi pour savoir s'il est possible de donner un coup de main. En effet, si tu participes au désherbage, il sera peut-être possible de renoncer à des produits nocifs;Weeds are largely controlled by chemical means or by flaming and heat-generating equipment. Chemical agents often also harm desirable plants and often remain in the soil for a long time But flaming and heat-generating devices sometimes harm living organisms in the upper soil layers. <br><strong>Improvement Tip:</strong><br> Find out about other ways to control weeds. You can<br>find more information on this on the<br>BioDiv practice page<br>. Then meet with the people who control weeds. Think together about how to control weeds more gently. <br><strong>Care Tip:</strong><br> To fight weeds by hand is very laborious. Find out if it is possible to help out. Because if you help with weeding, perhaps harmful means can be dispensed with;Il controllo delle erbe infestanti avviene in gran parte con mezzi chimici o con dispositivi che generano fiamme e calore. Gli agenti chimici spesso danneggiano le piante desiderate e rimangono a lungo nel terreno, ma le fiamme e i dispositivi che generano calore a volte danneggiano gli organismi viventi negli strati superiori del suolo. <br><strong>Suggerimento per il miglioramento:</strong><br> Scoprite altri modi per controllare le erbacce. Per ulteriori informazioni, consultare la pagina pratica di BioDiv<br>. Poi incontrate le persone che controllano le erbacce. Pensate insieme a come controllare le erbacce in modo più delicato. <br><strong>Consiglio per la cura:</strong><br> Combattere le erbacce a mano richiede molto tempo. Scoprite se è possibile dare una mano. Perché se si aiuta a diserbare, si può fare a meno di agenti nocivi
A32.3;Unkräuter werden mit recht wenig chemischen Mitteln bekämpft. Das ist recht gut. Doch oft ist es gar nicht nötig, alles «sauber» zu halten. Denn so genannte Unkräuter tragen eigentlich auch zur Artenvielfalt bei. <br><strong>Verbesserungs-Tipp:</strong><br> Informiere dich über andere Möglichkeiten zur Bekämpfung von Unkräutern. Auf der<br>BioDiv-Praxisseite<br>findest du dazu weiterführende Informationen. Triff dich dann mit den Personen, die Unkräuter bekämpfen. Überlegt zusammen, wie Unkräuter noch schonender bekämpft werden können. <br><strong>Pflege-Tipp:</strong><br>  Unkraut durch Handarbeit zu bekämpfen ist sehr aufwendig. Erkundige dich, ob es möglich ist, dabei mitzuhelfen. Denn wenn du beim Jäten mithilfst, kann vielleicht auf schädliche Mittel verzichtet werden.;"Les mauvaises herbes sont combattues avec assez peu de produits chimiques. C'est une bonne chose. Mais souvent, il n'est pas nécessaire de tout garder ""propre"". Car les dites mauvaises herbes contribuent en fait aussi à la biodiversité. <br><strong>Conseil d'amélioration:</strong><br> Informe-toi sur les autres possibilités de lutte contre les mauvaises herbes. Tu trouveras des informations complémentaires à ce sujet sur le<br>site pratique de BioDiv<br>. Rencontre ensuite les personnes qui luttent contre les mauvaises herbes. Réfléchissez ensemble à la manière dont les mauvaises herbes peuvent être combattues de manière encore plus douce. <br><strong>Conseil d'entretien:</strong><br>La lutte contre les mauvaises herbes à la main est très coûteuse. Renseigne-toi pour savoir s'il est possible de donner un coup de main. En effet, si tu participes au désherbage, il sera peut-être possible de renoncer à des produits nocifs";"Weeds are controlled with quite few chemical agents. This is quite good. But often it is not even necessary to keep everything ""clean"". Because so-called weeds actually also contribute to biodiversity. <br><strong>Improvement Tip:</strong><br> Find out about other ways to fight weeds. You can<br>find more information on this on the<br>BioDiv practice page<br>. Then meet with the people who control weeds. Think together about how weeds can be controlled even more gently. <br><strong>Care Tip:</strong><br> To fight weeds by hand is very laborious. Find out if it is possible to help out. Because if you help with the weeding, perhaps harmful means can be dispensed with";"Le erbe infestanti sono controllate con pochissimi prodotti chimici. È un'ottima cosa. Ma spesso non è nemmeno necessario tenere tutto ""pulito"". Perché anche le cosiddette erbacce contribuiscono alla biodiversità. <br><strong>Suggerimento per il miglioramento:</strong><br> Scoprite altri modi per controllare le erbacce. Per ulteriori informazioni, consultare la pagina della pratica di BioDiv<br>. Poi incontrate le persone che controllano le erbacce. Pensate insieme a come controllare le erbacce in modo più delicato. <br><strong>Consiglio per la cura:</strong><br> Combattere le erbacce a mano richiede molto tempo. Scoprite se è possibile dare una mano. Perché se si aiuta a diserbare, si può fare a meno di agenti nocivi"
A32.4;Unkräuter werden zur Hauptsache durch Handarbeit bekämpft. Das ist sehr gut! Doch oft ist es gar nicht nötig, alles «sauber» zu halten. Denn so genannte Unkräuter tragen eigentlich auch zur Artenvielfalt bei. <br><strong>Pflege-Tipp:</strong><br>  Unkraut durch Handarbeit zu bekämpfen ist sehr aufwendig. Erkundige dich, ob es möglich ist, dabei mitzuhelfen. Denn wenn du beim Jäten mithilfst, kann vielleicht auf schädliche Mittel verzichtet werden.;"Les mauvaises herbes sont principalement combattues à la main. C'est très bien ! Mais souvent, il n'est pas nécessaire de tout garder ""propre"". Car les soi-disant mauvaises herbes contribuent en fait aussi à la biodiversité. <br><strong>Conseil d'entretien:</strong><br> Lutter contre les mauvaises herbes par un travail manuel est très coûteux. Renseigne-toi pour savoir s'il est possible de donner un coup de main. En effet, si tu participes au désherbage, il sera peut-être possible de renoncer à des produits nocifs";"Weeds are mainly controlled by manual labor. This is very good! But often it is not even necessary to keep everything ""clean"". Because so-called weeds actually also contribute to biodiversity. <br><strong>Care Tip:</strong><br> To fight weeds by hand is very costly. Find out if it is possible to help out. Because if you help with the weeding, perhaps harmful means can be dispensed with";"Le erbe infestanti sono controllate principalmente con il lavoro manuale. Molto bene! Ma spesso non è necessario tenere tutto ""pulito"". Perché anche le cosiddette erbacce contribuiscono alla biodiversità. <br><strong>Consiglio per la cura:</strong><br> Combattere le erbacce a mano richiede molto tempo. Scoprite se è possibile dare una mano. Perché se si aiuta a diserbare, si può fare a meno di agenti nocivi"
A33.0;Es gibt keine Angaben, wie Grasflächen gedüngt werden. Düngemittel sind nichts Anderes als Nährstoffe für Pflanzen. Deshalb fördern Düngemittel oft das Wachstum von nur einigen wenigen Pflanzenarten. In ungedüngten Böden ist die Artenvielfalt deshalb oft höher als in gedüngten Böden.;Il n'existe aucune indication sur la manière de fertiliser les prairies. Les engrais ne sont rien d'autre que des substances nutritives pour les plantes. C'est pourquoi les engrais ne favorisent souvent la croissance que de quelques espèces végétales. C'est pourquoi la diversité des espèces est souvent plus élevée dans les sols non fertilisés que dans les sols fertilisés;There is no indication of how grasslands are fertilized. Fertilizers are nothing more than nutrients for plants. Therefore, fertilizers often promote the growth of only a few plant species. Therefore, in unfertilized soils, species diversity is often higher than in fertilized soils.;Non ci sono indicazioni su come vengono concimate le praterie. I fertilizzanti non sono altro che sostanze nutritive per le piante. Pertanto, i fertilizzanti spesso promuovono la crescita solo di alcune specie vegetali. Nei terreni non concimati, la biodiversità è quindi spesso più elevata che nei terreni fertilizzati
A33.1;Die Grasflächen werden nicht gedüngt. Das ist sehr gut! Denn überschüssige Düngemittel gelangen oft mit dem Regen in Gewässer. In Gewässer kann Dünger zu übermässigem Algenwachstum führen. Zudem ist in ungedüngten Böden die Artenvielfalt oft höher als in gedüngten Böden.;Les prairies ne sont pas fertilisées. C'est une très bonne chose ! En effet, les excédents d'engrais se retrouvent souvent dans les cours d'eau avec la pluie. Dans les cours d'eau, les engrais peuvent entraîner une croissance excessive des algues. De plus, la biodiversité est souvent plus élevée dans les sols non fertilisés que dans les sols fertilisés;Grasslands are not fertilized. This is very good! Because excess fertilizers often end up in water bodies with the rain. In water bodies, fertilizer can lead to excessive algae growth. In addition, species diversity is often higher in unfertilized soils than in fertilized soils.;I prati non sono concimati. Questo è molto buono! Perché i fertilizzanti in eccesso spesso finiscono nei corpi idrici con la pioggia. Nei corpi idrici, i fertilizzanti possono portare a una crescita eccessiva di alghe. Inoltre, la diversità delle specie è spesso più elevata nei terreni non concimati che in quelli fertilizzati
A33.2;Die Grasflächen werden gedüngt ohne zu analysieren, welche Nährstoffe der Boden braucht. Das ist nicht gut! Denn überschüssige Düngemittel gelangen oft mit dem Regen in Gewässer. In Gewässer kann Dünger zu übermässigem Algenwachstum führen. Zudem ist in ungedüngten Böden die Artenvielfalt oft höher als in gedüngten Böden. <br><strong>Verbesserungs-Tipp:</strong><br> Informiere dich über verschiedene Möglichkeiten des Düngens. Auf der<br>BioDiv-Praxisseite<br>findest du dazu weiterführende Informationen. Triff dich dann mit den Personen, die düngen. Überlegt zusammen, wo und wie gedüngt werden soll.;Les prairies sont fertilisées sans analyser de quels éléments nutritifs le sol a besoin. Ce n'est pas bon ! En effet, les excédents d'engrais se retrouvent souvent dans les eaux avec la pluie. Dans les cours d'eau, les engrais peuvent entraîner une croissance excessive des algues. De plus, la biodiversité est souvent plus élevée dans les sols non fertilisés que dans les sols fertilisés. <br><strong>Conseil d'amélioration:</strong><br> Informe-toi sur les différentes possibilités de fertilisation. Tu trouveras des informations complémentaires à ce sujet sur le<br>site pratique de BioDiv<br>. Rencontre ensuite les personnes qui fertilisent. Réfléchissez ensemble à l'endroit et à la manière de fertiliser;Grasslands are fertilized without analyzing what nutrients the soil needs. This is not good! Because excess fertilizers often get into water bodies with the rain. In water bodies, fertilizer can lead to excessive algae growth. In addition, biodiversity is often higher in unfertilized soils than in fertilized soils. <br><strong>Improvement Tip:</strong><br> Find out about different ways to fertilize. On the<br>BioDiv practice page<br>you will find more information on this. Then meet with the people who fertilize. Consider together where and how to fertilize;I pascoli vengono concimati senza analizzare i nutrienti di cui il terreno ha bisogno. Non va bene! Perché i fertilizzanti in eccesso spesso finiscono nei corpi idrici con la pioggia. Nei corpi idrici, i fertilizzanti possono portare a una crescita eccessiva di alghe. Inoltre, la biodiversità è spesso più elevata nei terreni non fertilizzati che in quelli fertilizzati. <br><strong>Consiglio di miglioramento:</strong><br> Informatevi sui diversi metodi di concimazione. Nella pagina della pratica<br>BioDiv<br>sono disponibili ulteriori informazioni al riguardo. Poi incontrate le persone che fertilizzano. Pensate insieme a dove e come concimare
A33.3;Die Grasflächen werden erst gedüngt, wenn eine Analyse des Bodens zeigt, welche Nährstoffe der Boden braucht. Das ist recht gut! Denn überschüssige Düngemittel gelangen oft mit dem Regen in Gewässer. In Gewässer kann Dünger zu übermässigem Algenwachstum führen. Zudem ist in ungedüngten Böden die Artenvielfalt oft höher als in gedüngten Böden. <br><strong>Verbesserungs-Tipp:</strong><br> Informiere dich über verschiedene Möglichkeiten des Düngens. Auf der<br>BioDiv-Praxisseite<br>findest du dazu weiterführende Informationen. Triff dich dann mit den Personen, die düngen. Überlegt zusammen, welche Flächen überhaupt gedüngt werden sollen.;Les surfaces d'herbe ne sont fertilisées que lorsqu'une analyse du sol montre de quels éléments nutritifs le sol a besoin. C'est plutôt une bonne chose ! En effet, les excédents d'engrais se retrouvent souvent dans les eaux avec la pluie. Dans les cours d'eau, les engrais peuvent entraîner une croissance excessive des algues. De plus, la biodiversité est souvent plus élevée dans les sols non fertilisés que dans les sols fertilisés. <br><strong>Conseil d'amélioration:</strong><br> Informe-toi sur les différentes possibilités de fertilisation. Tu trouveras des informations complémentaires à ce sujet sur le<br>site pratique de BioDiv<br>. Rencontre ensuite les personnes qui fertilisent. Réfléchis ensemble aux surfaces qui doivent être fertilisées;Do not fertilize the grass areas until an analysis of the soil shows what nutrients the soil needs. This is quite good! This is because excess fertilizers often end up in water bodies with the rain. In water bodies, fertilizer can lead to excessive algae growth. In addition, biodiversity is often higher in unfertilized soils than in fertilized soils. <br><strong>Improvement Tip:</strong><br> Find out about different ways to fertilize. On the<br>BioDiv practice page<br>you will find more information on this. Then meet with the people who fertilize. Think together about which areas should be fertilized in the first place;Le aree erbose vengono concimate solo quando l'analisi del terreno mostra quali sono i nutrienti di cui il terreno ha bisogno. E' molto bello! Questo perché i fertilizzanti in eccesso finiscono spesso nei corpi idrici con la pioggia. Nei corpi idrici, i fertilizzanti possono portare a una crescita eccessiva di alghe. Inoltre, la biodiversità è spesso più elevata nei terreni non fertilizzati che in quelli fertilizzati. <br><strong>Consiglio di miglioramento:</strong><br> Informatevi sui diversi metodi di concimazione. Nella pagina della pratica<br>BioDiv<br>sono disponibili ulteriori informazioni al riguardo. Poi incontrate le persone che fertilizzano. Pensate insieme a quali aree devono essere concimate in primo luogo
