id;de;fr;en;
A14.0;Du hast nicht eingetragen, ob es Bäume gibt. Bäume bieten Nahrung und ein Zuhause für eine Vielzahl von Lebewesen.;;;
A14.1;Im Untersuchungsgebiet gibt es keine hohen Bäume. Bäume bieten Nahrung und ein Zuhause für eine Vielzahl von Lebewesen. Verbesserungs-Tipp: Pflanze möglichst hohe heimische Bäume. Dabei kann dich eine Fachperson von der BioDiv-Kontaktliste beraten.;;;
A14.2;Im Untersuchungsgebiet gibt es nur gerade einen hohen Baum. Oder alle Bäume sind gleich hoch. Verschieden hohe Bäume bieten mehr unterschiedlichen Lebewesen ein Zuhause.Verbesserungs-Tipp: Pflanze weitere heimische Bäume. Dabei kann dich eine Fachperson von der BioDiv-Kontaktliste beraten.;;;
A14.3;Im Untersuchungsgebiet gibt es Bäume in unterschiedlichen Höhen. Das ist gut. Ideal ist es, wenn es möglichst viele unterschiedliche heimische Baumarten sind. Denn verschiedene heimische Bäume in unterschiedlicher Höhe bieten mehr verschiedenen Lebewesen ein Zuhause. Verbesserungs-Tipp: Pflanze weitere Bäume. Achte darauf, dass du möglichst verschiedene und heimische Bäume pflanzt. Dabei kann dich eine Fachperson von der BioDiv-Kontaktliste beraten.;;;
A14.4;Zudem gibt es auch drei oder mehr verschiedene heimische Baumarten. Das ist sehr gut. Denn verschiedene heimische Bäume in unterschiedlicher Höhe bieten mehr verschiedenen Lebewesen ein Zuhause.